{
  "schema_version": "reviewed-development-set/1",
  "digest": "f9cf81db5cf356748a8b535a4a05ec6d910a0e9b4d81fa252424968e42823576",
  "ontology_snapshot_digest": "942c84a70c2ae0c45aa5665ecb85e03abbefdbf8fdd20760dedc99594d27511e",
  "examples": [
    {
      "example_id": "023d85b3c0a63b6dda137f4ea28cec17574cda25d52697d1f80f0032c92fbdd9",
      "task": "structured_fact_semantics",
      "training_candidate_id": "nasa-npsl:7493f78d189d7a0fbfa7b17fdd7d359f65949357e779654f571dfa08522243ad",
      "expected_target_json": {
        "external_field_key": "h_FE_min_max",
        "predicate_term_id": "discrete.bjt.forward_current_gain",
        "quantity_kind": "datasheet:Ratio",
        "raw_unit": null,
        "raw_value": "40/120",
        "regime": null,
        "source_part_number": "JAN#@2N4150S",
        "value_shape": "range"
      },
      "observation_ids": [
        "60e03b8644e7c5f10398c47b943bf66ac0e6978e3577eb18d522a0d48161efdb"
      ],
      "reviewer_record_id": "7967b54b63b162eb57c14e297bf1ebcda5bd20372f14d9bb279ab88438cc63f9"
    },
    {
      "example_id": "06098be4bd9fda72da673817502cd0358cc67e72d349a1832fafc1245b9899a6",
      "task": "structured_fact_semantics",
      "training_candidate_id": "nasa-npsl:79b97439d84e2c1c8b39dc7fdc4d3d61d368d6410e642dc7dc339c1eec111d79",
      "expected_target_json": {
        "external_field_key": "I_C",
        "predicate_term_id": "discrete.bjt.collector_current",
        "quantity_kind": "si:ElectricCurrent",
        "raw_unit": "A",
        "raw_value": "0.2",
        "regime": null,
        "source_part_number": "JAN#@2N2369A",
        "value_shape": "scalar"
      },
      "observation_ids": [
        "1491d7f41ab30e01211dba3ef01caa5512eb2c740d094daa41cf6713479aef39"
      ],
      "reviewer_record_id": "7351821252c817f78a98c3c5dce9a9d25a4251da22e357bd7c06ab2d52103849"
    },
    {
      "example_id": "0884fcd32048d8dc7878404ccc07115354b58d61380ebe146cf5b2403a1e1ce5",
      "task": "structured_fact_semantics",
      "training_candidate_id": "nasa-npsl:82cc2fcb668f83e1a973d2ff0bb3b8a8772781071743b18ed16a6b28ecb3e5fd",
      "expected_target_json": {
        "external_field_key": "h_FE_min_max",
        "predicate_term_id": "discrete.bjt.forward_current_gain",
        "quantity_kind": "datasheet:Ratio",
        "raw_unit": null,
        "raw_value": "30/150",
        "regime": null,
        "source_part_number": "JAN#@2N3507",
        "value_shape": "range"
      },
      "observation_ids": [
        "4545267a87b72ab0ba1a59da03ec5fcfaba1e9c3f67d110956c889f0e044fa57"
      ],
      "reviewer_record_id": "fb6337ffb112741403313b4bc145a2270ed24554ad576225adfd16ad645cf849"
    },
    {
      "example_id": "0952bc82d1d3783fa5c0f961bace3c800179f17e47d7b43a867d0efcfeca4e9d",
      "task": "structured_fact_semantics",
      "training_candidate_id": "nasa-npsl:39e0b41e5dae5d2067875f6d30328f61acb798ee99cca87ef9168b7b8d16e4ef",
      "expected_target_json": {
        "external_field_key": "V_CEO",
        "predicate_term_id": "discrete.bjt.collector_emitter_voltage.open_base",
        "quantity_kind": "electronics:ElectricPotential",
        "raw_unit": "V",
        "raw_value": "125",
        "regime": null,
        "source_part_number": "JAN#@2N3419",
        "value_shape": "scalar"
      },
      "observation_ids": [
        "e649357e2cc6e4fd41b4fabc65be608f655524ff966f14361f65007b8c2a9094"
      ],
      "reviewer_record_id": "6c9440e120fa27e87b24d412bc53d18ceb4ac3b710ca4d9b78b801d627696dd1"
    },
    {
      "example_id": "0f3542eee7b4d840c04233bf39e9089ee9bdf3209ccf065415c44577c5b0a101",
      "task": "structured_fact_semantics",
      "training_candidate_id": "nasa-npsl:2aba825899060b46b63060af6be47a476c5f78bf819d422167414f1889deea26",
      "expected_target_json": {
        "external_field_key": "I_C",
        "predicate_term_id": "discrete.bjt.collector_current",
        "quantity_kind": "si:ElectricCurrent",
        "raw_unit": "A",
        "raw_value": "3.0",
        "regime": null,
        "source_part_number": "JAN#@2N3419",
        "value_shape": "scalar"
      },
      "observation_ids": [
        "7f20d6b2da49a1c353f54939b86d5c78423216a4bd7f0a763d12fec39f70e34e"
      ],
      "reviewer_record_id": "a11eac89cdc60664efd9c68441774aad984ed7f92316e1e601ab2cfdbab0a6f3"
    },
    {
      "example_id": "1304c59233efbc1ec3cb2a94dc98bdb230fcbca561f2c5b5627915ac9faf231f",
      "task": "structured_fact_semantics",
      "training_candidate_id": "nasa-npsl:53bff1aad4df549b3af250c30545e641cbb4a3d77e5eba17859bc146264ad217",
      "expected_target_json": {
        "external_field_key": "V_EBO",
        "predicate_term_id": "discrete.bjt.emitter_base_voltage.open_collector",
        "quantity_kind": "electronics:ElectricPotential",
        "raw_unit": "V",
        "raw_value": "8.0",
        "regime": null,
        "source_part_number": "JAN#@2N3419",
        "value_shape": "scalar"
      },
      "observation_ids": [
        "2a8abe3ba72c719f98754e4fc359c1e6724d4b95a646a2fd68b046a005bdae23"
      ],
      "reviewer_record_id": "6f54e63225ec974c8cb4c44578e3d461e45185fd8384c2a129a97e2a6347fbf6"
    },
    {
      "example_id": "17f30e06ebb1d13c9ed6d62bd3f3a49a179ca4308381056d028be5fc340fabb2",
      "task": "structured_fact_semantics",
      "training_candidate_id": "nasa-npsl:c2a58102ddd6527e056e81d13501b790dad603b524957ef9419114541de4d1b4",
      "expected_target_json": {
        "external_field_key": "V_EBO",
        "predicate_term_id": "discrete.bjt.emitter_base_voltage.open_collector",
        "quantity_kind": "electronics:ElectricPotential",
        "raw_unit": "V",
        "raw_value": "4.5",
        "regime": null,
        "source_part_number": "JAN#@2N2369A",
        "value_shape": "scalar"
      },
      "observation_ids": [
        "54d70e814d0c2c44b24d445195e9851d581e5e8ead9267d62d3e8baaa4931b51"
      ],
      "reviewer_record_id": "bbdc5d3013b5845f747f39e9af37e6149d6ff22574ce2f1fe904bf2fac9b9472"
    },
    {
      "example_id": "1a89b3bfb4bea2712beef2c49cd05ea93374887c28bace9c39f58a624bd56660",
      "task": "structured_fact_semantics",
      "training_candidate_id": "nasa-npsl:dd7ec2b05dda9b904e88d679d11bf486715d7cdb8d095909cf4c9494519b1c83",
      "expected_target_json": {
        "external_field_key": "V_CEO",
        "predicate_term_id": "discrete.bjt.collector_emitter_voltage.open_base",
        "quantity_kind": "electronics:ElectricPotential",
        "raw_unit": "V",
        "raw_value": "200",
        "regime": null,
        "source_part_number": "JAN#@2N5660",
        "value_shape": "scalar"
      },
      "observation_ids": [
        "64447c10b59685211e85d66c087836640555580dc5615e749fe5887ead8711c8"
      ],
      "reviewer_record_id": "0d4aca9e9dc98f69493d5c18d920c45e78804f075d9a15c496df4d626b7dfb7f"
    },
    {
      "example_id": "1fd125523216716f15b520624ff205c71f640736960da5eb73b2b6bf927facb9",
      "task": "structured_fact_semantics",
      "training_candidate_id": "nasa-npsl:2c8745f5523c2873967f1510b3f74a5181740dec1ced54b7fd12e7015427fd54",
      "expected_target_json": {
        "external_field_key": "V_EBO",
        "predicate_term_id": "discrete.bjt.emitter_base_voltage.open_collector",
        "quantity_kind": "electronics:ElectricPotential",
        "raw_unit": "V",
        "raw_value": "6.0",
        "regime": null,
        "source_part_number": "JAN#@2N5660",
        "value_shape": "scalar"
      },
      "observation_ids": [
        "083331297f305a041068c45f82316c1079d98f46fb357c58fb532f17d9f29c42"
      ],
      "reviewer_record_id": "1d06e460ef674c7da1ff2f8da90d5f9de5f8cbc2b408699313a4a9eebc694c48"
    },
    {
      "example_id": "2cef108224da2620764bf27fe208cb0805f88837bedb08fa27a9b136d877ad7a",
      "task": "structured_fact_semantics",
      "training_candidate_id": "nasa-npsl:7a3a48d060fc2391f6ad6a7438b2f2023ba86b196fbf76ddfbdaeb7cc24bf48f",
      "expected_target_json": {
        "external_field_key": "V_CEO",
        "predicate_term_id": "discrete.bjt.collector_emitter_voltage.open_base",
        "quantity_kind": "electronics:ElectricPotential",
        "raw_unit": "V",
        "raw_value": "30",
        "regime": null,
        "source_part_number": "JAN#@2N2219",
        "value_shape": "scalar"
      },
      "observation_ids": [
        "3be22c12af54ce403f3992147aa1a776c72b29047d06ee7a0ff06fad8688e792"
      ],
      "reviewer_record_id": "6318cd2e26c92a31ad40148372bb20c95cd1c3fd68f1497f7e313d4f76bee95a"
    },
    {
      "example_id": "2fb69c70fc90ae66dd02ebf1be3d747b52529bd0429fc506e4e77552d18d9eee",
      "task": "structured_fact_semantics",
      "training_candidate_id": "nasa-npsl:73ee2530629500e80a535462afd9ac5645346aa4f022aa214d5524203bbc3277",
      "expected_target_json": {
        "external_field_key": "h_FE_at_I_C",
        "predicate_term_id": "condition.bjt.collector_current.for_forward_gain",
        "quantity_kind": "si:ElectricCurrent",
        "raw_unit": "mA",
        "raw_value": "1.0",
        "regime": null,
        "source_part_number": "JAN#@2N3419",
        "value_shape": "scalar"
      },
      "observation_ids": [
        "58e9642f6ec86008b8358f7933aa4ef60c89a8d51a3f2d8ce9c5e4044200ec77"
      ],
      "reviewer_record_id": "51d791b54efef0bbbab147be7465b9d56a7f5ca75501f4bb547b4dd2c0f8e544"
    },
    {
      "example_id": "33ced347acb5c68a86d576dc045945261f44cf75fcf790d33b930289accdfb87",
      "task": "structured_fact_semantics",
      "training_candidate_id": "nasa-npsl:1858c07e70adc2badb2c3f882e30103fefed21a00073837775bf158bf3a9a89a",
      "expected_target_json": {
        "external_field_key": "I_C",
        "predicate_term_id": "discrete.bjt.collector_current",
        "quantity_kind": "si:ElectricCurrent",
        "raw_unit": "A",
        "raw_value": "2.0",
        "regime": null,
        "source_part_number": "JAN#@2N5660",
        "value_shape": "scalar"
      },
      "observation_ids": [
        "2b57632ada8aae6a04d1ca12e6a4b1ece8f3d54659da8db4300ac7bb2a268ad6"
      ],